id,query,tool_call
Q-00766,I need to log an alert — Vicuña pressure sensors just hit 89.9 kPa and they’re still trending down.,"send_alert(module='vicuna',severity='high',reason='pressure_drop')"
Q-00767,Kai Nakamura just reported CO2 concentration in Quetzal is at 2.3% and rising—crew has headaches. What emergency steps do we take?,"activate_protocol(protocol_id='MASA-SEC-009',scope='module_only')"
Q-00768,Hull stress readings in Vicuña have hit 88.0% and are still rising—what emergency steps do we take for this scenario?,"activate_protocol(protocol_id='MASA-SEC-008',scope='module_only')"
Q-00769,Water recycling in Jaguar is down to 33.7% and has been dropping for hours—what emergency steps do we take for this scenario?,"activate_protocol(protocol_id='MASA-SEC-015',scope='station_wide')"
Q-00772,Jaguar hull stress sensors just spiked to 88.3% — Kai Nakamura reports possible micrometeorite impact. Do we flag this for immediate review?,"send_alert(module='jaguar',severity='high',reason='structural_damage')"
Q-00773,Can you pull up the full background profile for Commander Santiago Reyes before the next crew briefing?,no_action
Q-00774,Cóndor power bus voltage just hit 139.5 V—this is outside normal range. Escalate this immediately.,"send_alert(module='condor',severity='medium',reason='power_fluctuation')"
Q-00775,Notify Fatima that the latest atmospheric readings from Jaguar need review before the next shift change.,"send_message(recipient='specialist_2',priority='medium')"
Q-00777,Oxygen readings in Quetzal have dropped to 14.1% and are still falling — what’s the emergency procedure for this scenario?,"activate_protocol(protocol_id='MASA-SEC-010',scope='module_only')"
Q-00778,"We’ve got a rapid pressure drop in Colibrí, currently reading 73.5 kPa—what emergency procedure should we initiate for this scenario?","activate_protocol(protocol_id='MASA-SEC-001',scope='station_wide')"
Q-00779,"Ana Valdivia just reported headaches, and CO2 concentration in Quetzal is now at 2.0% and climbing—should we escalate this?","send_alert(module='quetzal',severity='high',reason='oxygen_leak')"
Q-00780,Vicuña hull stress sensors are reading 91.4%—Commander Reyes just reported a possible micrometeorite impact. What emergency procedure should we initiate?,"activate_protocol(protocol_id='MASA-SEC-008',scope='module_only')"
Q-00782,"We’ve got a rapid pressure drop in Quetzal, currently reading 80.4 kPa—what emergency procedure should we initiate for this scenario?","activate_protocol(protocol_id='MASA-SEC-001',scope='station_wide')"
Q-00783,Oxygen readings in Jaguar have dropped to 15.5% over the past 30 minutes—what emergency procedure should we initiate for this?,"activate_protocol(protocol_id='MASA-SEC-010',scope='module_only')"
Q-00784,Tucán hull stress sensors are reading 94.7%—should we log an alert for possible micrometeorite impact?,"send_alert(module='tucan',severity='high',reason='structural_damage')"
Q-00785,Notify Specialist Nakamura that the sample analysis from Quetzal is ready for review and needs his input before the next shift.,"send_message(recipient='specialist_1',priority='medium')"
Q-00786,Kozlov just reported an equipment failure in Vicuña that's affecting critical systems—we need emergency supplies sent up immediately.,"request_supply(category='equipment',urgency='emergency')"
Q-00787,Medical Officer Mendoza just reported the air filters in Tucán are clogged and need immediate replacement—can we get this scheduled as top priority before the next shift change?,"schedule_maintenance(module='tucan',task='filter_replacement',priority='urgent')"
Q-00788,Kai Nakamura just reported CO2 concentration in Jaguar has hit 2.3% and crew members are experiencing headaches. Should we escalate this to command?,"send_alert(module='jaguar',severity='high',reason='oxygen_leak')"
Q-00789,Lower the heating level in Jaguar — Kozlov reports temperatures are climbing above nominal.,"control_system(module='jaguar',system='heating',action='decrease')"
Q-00790,Can we confirm the current schedule for the crew in Cóndor? I need to verify Commander Reyes' availability for the upcoming comms window.,"get_crew_status(module='condor',info='schedule')"
Q-00791,Check the current communications system status in Quetzal—we need to confirm it's fully operational before the next experiment upload.,"get_module_status(module='quetzal',system='communications')"
Q-00793,Tucán oxygen concentration has dropped to 14.3% and is still falling — what emergency procedure do we initiate right now?,"activate_protocol(protocol_id='MASA-SEC-010',scope='module_only')"
Q-00795,Vicuña hull stress sensors are reading 90.0%—Commander Reyes reports a potential micrometeorite impact. What emergency procedure should we initiate?,"activate_protocol(protocol_id='MASA-SEC-008',scope='module_only')"
Q-00796,Cóndor's power grid is at 97.4% capacity—Reyes just reported grid stress. What emergency steps should we initiate immediately?,"send_alert(module='condor',severity='critical',reason='power_fluctuation')"
Q-00797,"We’re seeing a voltage fluctuation on the Colibrí power bus, with readings dropping to 97.4 V. What emergency procedure should we initiate for this scenario?","activate_protocol(protocol_id='MASA-SEC-018',scope='module_only')"
Q-00798,Radiation sensors in Jaguar are showing 8.9 mSv/hr and still rising—how should we respond to this?,"send_alert(module='jaguar',severity='critical',reason='radiation_spike')"
Q-00799,What is the current schedule for the crew in the Colibrí module?,"get_crew_status(module='colibri',info='schedule')"
Q-00800,Pull the last 12 hours of power data from Jaguar for review.,"get_telemetry(module='jaguar',metric='power',timeframe_hours=12)"
Q-00801,Notify Specialist Nakamura that the sample analysis from Quetzal is ready for review when he has a moment.,"send_message(recipient='specialist_1',priority='low')"
Q-00802,Cóndor airlock equalization rate is reading 1.1 kPa per minute—what emergency response should we initiate?,"activate_protocol(protocol_id='MASA-SEC-017',scope='module_only')"
Q-00803,We’ve got a rising CO2 issue in Colibrí—readings just hit 1.9% and climbing. Commander Reyes reports headaches from the crew. What emergency steps should we take here?,"activate_protocol(protocol_id='MASA-SEC-009',scope='module_only')"
Q-00804,Check current health status for the crew member working in Jaguar right now.,"get_crew_status(module='jaguar',info='health')"
Q-00805,Can you give me a quick overview of Kuntur Station's current mission and module layout for the new trainee's orientation?,no_action
Q-00806,"Kai just reported voltage fluctuations on Quetzal's power bus, with readings dropping to 100.4 V—should we flag this for command review?","send_alert(module='quetzal',severity='medium',reason='power_fluctuation')"
Q-00807,Pull the temperature readings from Vicuña for the last 12 hours—need to verify storage conditions.,"get_telemetry(module='vicuna',metric='temperature',timeframe_hours=12)"
Q-00810,Tucán pressure sensors are at 88.8 kPa and still dropping—what emergency response should we initiate?,"send_alert(module='tucan',severity='high',reason='pressure_drop')"
Q-00811,Radiation sensors in Quetzal are reading 1.3 mSv/hr and rising—what emergency steps should we take station-wide?,"activate_protocol(protocol_id='MASA-SEC-012',scope='station_wide')"
Q-00812,Cóndor's power grid is at 98.4% capacity with stress indicators—what emergency response should we initiate? Commander Reyes reports fluctuations in the command module.,"activate_protocol(protocol_id='MASA-SEC-006',scope='station_wide')"
Q-00813,Vicuña hull stress sensors just hit 89.6% and climbing — Commander Reyes reports a possible micrometeorite impact. What emergency steps do we take for this scenario?,"send_alert(module='vicuna',severity='high',reason='structural_damage')"
Q-00814,"We've got a voltage fluctuation on Jaguar's power bus, currently reading 137.8 V. What emergency procedure should we initiate for this scenario?","activate_protocol(protocol_id='MASA-SEC-018',scope='module_only')"
Q-00815,Tucán radiation sensors are showing 1.5 mSv/hr and rising—what emergency response should we initiate? Commander Reyes reports solar activity may be increasing.,"activate_protocol(protocol_id='MASA-SEC-012',scope='station_wide')"
Q-00816,Cóndor radiation sensors just spiked to 10.2 mSv/hr—Commander Reyes is reporting this now. What emergency steps do we initiate?,"send_alert(module='condor',severity='critical',reason='radiation_spike')"
Q-00817,Check the life support status in Cóndor—we need to confirm systems are nominal before the next shift.,"get_module_status(module='condor',system='life_support')"
Q-00818,Kai just reported Jaguar's hull stress sensors are reading 90.7%—what emergency response should we initiate?,"activate_protocol(protocol_id='MASA-SEC-008',scope='module_only')"
Q-00819,Tucán power bus showing 139.1 V voltage fluctuation — what emergency procedure do we run for this?,"activate_protocol(protocol_id='MASA-SEC-018',scope='module_only')"
Q-00820,Radiation sensors in Vicuña are reading 9.4 mSv/hr and climbing — what emergency procedure do we initiate for this?,"activate_protocol(protocol_id='MASA-SEC-004',scope='station_wide')"
Q-00821,Tucán CO2 sensors hit 2.5% and rising—crew reporting headaches since 0400. What emergency procedure do we initiate?,"send_alert(module='tucan',severity='high',reason='oxygen_leak')"
Q-00822,We need an immediate trajectory calculation for the incoming docking maneuver—confirm parameters before the next shift change.,"calculate_trajectory(maneuver='docking',urgency='immediate')"
Q-00823,Tucán hull stress sensors are reading 94.9%—what emergency procedure should we initiate? Engineer Kozlov just reported possible micrometeorite impact.,"activate_protocol(protocol_id='MASA-SEC-008',scope='module_only')"
Q-00824,I need to log an alert — Vicuña pressure sensors just hit 88.1 kPa and they’re still trending down.,"send_alert(module='vicuna',severity='high',reason='pressure_drop')"
Q-00825,Activate the lighting systems in Quetzal for the upcoming experiment.,"control_system(module='quetzal',system='lighting',action='activate')"
Q-00826,Jaguar temperature is rising at 2.9 degrees per minute—what emergency procedure covers this kind of thermal event?,"activate_protocol(protocol_id='MASA-SEC-003',scope='module_only')"
Q-00829,Can someone pull the latest training module on emergency containment procedures from the MASA-SEC database before the next crew drill?,no_action
Q-00830,We've lost all ground contact through Colibrí—blackout now at 49 minutes and counting. What emergency procedure should we initiate for this communications failure?,"activate_protocol(protocol_id='MASA-SEC-007',scope='station_wide')"
Q-00832,Generate the planned orbital adjustments for station-keeping at 408 km LEO—calculate the trajectory parameters for the upcoming maneuver.,"calculate_trajectory(maneuver='station_keeping',urgency='planned')"
Q-00833,Can someone give me a quick overview of Kuntur Station's current mission and module layout before the next shift change?,no_action
Q-00834,Vicuña's temperature is rising at 3.8 degrees per minute—what emergency procedure covers this kind of thermal event?,"activate_protocol(protocol_id='MASA-SEC-003',scope='module_only')"
Q-00835,Can we expedite a spare parts request for the life support system in Jaguar? Kozlov says the CO2 scrubbers are showing signs of failure.,"request_supply(category='spare_parts',urgency='expedited')"
Q-00836,Schedule a routine software update for Cóndor during the next maintenance window.,"schedule_maintenance(module='condor',task='software_update',priority='routine')"
Q-00837,Jaguar airlock equalization rate is showing 1.2 kPa per minute and still increasing—what emergency procedure should we initiate for this scenario?,"activate_protocol(protocol_id='MASA-SEC-017',scope='module_only')"
Q-00838,Oxygen concentration in Quetzal just dropped to 10.2%—Kai Nakamura reports crew is feeling lightheaded. What emergency procedure do we initiate right now?,"activate_protocol(protocol_id='MASA-SEC-002',scope='station_wide')"
Q-00840,Shut down the cooling system in Colibrí—we're seeing unexpected temperature fluctuations during the comms array recalibration.,"control_system(module='colibri',system='cooling',action='deactivate')"
Q-00841,"I need to log an alert — CO2 concentration in Colibrí just hit 2.1% and is still rising. The crew is reporting headaches, and Specialist Nakamura noticed it first. What emergency procedure covers this?","send_alert(module='colibri',severity='high',reason='oxygen_leak')"
Q-00842,Radiation sensors in Tucán are reading 1.9 mSv/hr and climbing; should we log an alert for this increase?,"send_alert(module='tucan',severity='medium',reason='radiation_spike')"
Q-00843,Oxygen readings in Vicuña just dropped to 14.9% and still falling — what emergency steps do we take for this?,"activate_protocol(protocol_id='MASA-SEC-010',scope='module_only')"
Q-00844,Can we schedule a routine filter replacement in Cóndor during the next maintenance window?,"schedule_maintenance(module='condor',task='filter_replacement',priority='routine')"
Q-00845,Can we get a quick update on what Engineer Kozlov is currently working on in the Jaguar module?,"get_crew_status(module='jaguar',info='current_activity')"
Q-00846,Give me the radiation levels in Cóndor for the past hour—Commander Reyes wants a quick update.,"get_telemetry(module='condor',metric='radiation',timeframe_hours=1)"
Q-00847,Activate the ventilation system in Cóndor—commander reports stale air and needs circulation restored immediately.,"control_system(module='condor',system='ventilation',action='activate')"
Q-00848,"Ana Valdivia just reported headaches from Quetzal, CO2 concentration climbing to 2.8%—should we log an alert for this?","send_alert(module='quetzal',severity='high',reason='oxygen_leak')"
Q-00849,Radiation sensors in Tucán are reading 6.8 mSv/hr and still rising—what emergency steps should we take for this scenario?,"activate_protocol(protocol_id='MASA-SEC-004',scope='station_wide')"
Q-00850,Can we get the current power status for Quetzal before the next experiment cycle?,"get_module_status(module='quetzal',system='power')"
Q-00851,Can you pull up the full background profile for Commander Santiago Reyes before the next crew briefing?,no_action
Q-00853,Check current health status for the crew member working in Jaguar right now.,"get_crew_status(module='jaguar',info='health')"
Q-00854,Ana Valdivia just reported oxygen concentration in Quetzal is down to 14.2% — do we need to escalate this?,"send_alert(module='quetzal',severity='high',reason='oxygen_leak')"
Q-00855,Cóndor pressure sensors just dropped to 73.0 kPa—Reyes is reporting a possible hull breach. What emergency steps should we initiate for this situation?,"send_alert(module='condor',severity='critical',reason='pressure_drop')"
Q-00856,Schedule routine sensor maintenance in Vicuña for the next available window.,"schedule_maintenance(module='vicuna',task='sensor_repair',priority='routine')"
Q-00857,Jaguar oxygen concentration has dropped to 10.6%—Engineer Kozlov reports dizziness. What emergency procedure covers this?,"activate_protocol(protocol_id='MASA-SEC-002',scope='station_wide')"
Q-00859,Tucán radiation sensors are reading 3.6 mSv/hr and rising—what emergency response should we initiate?,"activate_protocol(protocol_id='MASA-SEC-012',scope='station_wide')"
Q-00860,Pull the humidity readings from Cóndor for the last 12 hours—need to verify environmental stability before the next shift change.,"get_telemetry(module='condor',metric='humidity',timeframe_hours=12)"
Q-00862,Can we expedite a food resupply to Kuntur Station? The crew’s rations are running lower than expected.,"request_supply(category='food',urgency='expedited')"
Q-00863,"Ana Valdivia just reported headaches from Quetzal, CO2 concentration climbing to 3.0%—should we log an alert for this?","send_alert(module='quetzal',severity='high',reason='oxygen_leak')"
Q-00864,We need to calculate the optimal reentry trajectory immediately—station altitude is 408 km LEO.,"calculate_trajectory(maneuver='reentry',urgency='immediate')"
Q-00866,Ana Valdivia just reported Colibrí's airlock equalization rate is holding at 1.3 kPa per minute — what emergency procedure covers this?,"activate_protocol(protocol_id='MASA-SEC-017',scope='module_only')"
Q-00867,"What’s the standard operational function of the Quetzal module, and which crew members are typically assigned there?",no_action
Q-00868,Activate the lighting system in Tucán crew quarters.,"control_system(module='tucan',system='lighting',action='activate')"
Q-00869,Can you pull up the mission history for Kuntur Station's Cóndor-7 mission before the next crew briefing?,no_action
Q-00870,"We’ve got a CO2 spike in Colibrí, currently reading 2.6% and climbing. Crew reports headaches—what emergency steps do we take?","activate_protocol(protocol_id='MASA-SEC-009',scope='module_only')"
Q-00871,Oxygen readings in Vicuña are at 15.6% and still dropping—what emergency response should we initiate?,"send_alert(module='vicuna',severity='high',reason='oxygen_leak')"
Q-00872,Shut down the filtration system in Quetzal—Nakamura reports it’s cycling erratically and needs immediate deactivation.,"control_system(module='quetzal',system='filtration',action='deactivate')"
Q-00873,We've lost all ground contact through Colibrí—blackout now at 49 minutes and counting. What emergency steps should we initiate for this communications failure?,"send_alert(module='colibri',severity='high',reason='communication_loss')"
Q-00874,"I need to log an alert — CO2 concentration in Jaguar is reading 2.4% and climbing, crew reports headaches. What emergency steps should we take?","send_alert(module='jaguar',severity='high',reason='oxygen_leak')"
Q-00875,Cóndor oxygen concentration just dropped to 14.4% and is still falling—Commander Reyes wants this logged as an alert immediately. What’s the next step here?,"send_alert(module='condor',severity='high',reason='oxygen_leak')"
Q-00877,Hull stress readings in Colibrí have hit 85.5%—what emergency response should we initiate here?,"activate_protocol(protocol_id='MASA-SEC-008',scope='module_only')"
Q-00878,Oxygen readings in Vicuña just dropped to 14.4% and still falling — what emergency procedure do we initiate right now?,"activate_protocol(protocol_id='MASA-SEC-010',scope='module_only')"
Q-00879,We’ve got a pressure anomaly in Vicuña—readings just hit 85.6 kPa and still dropping. What emergency procedure should we initiate for this scenario?,"activate_protocol(protocol_id='MASA-SEC-011',scope='module_only')"
Q-00880,Tucán oxygen concentration has dropped to 10.0% — what emergency procedure do we need to activate here?,"activate_protocol(protocol_id='MASA-SEC-002',scope='station_wide')"
Q-00881,"We’re seeing a rapid temperature rise in Colibrí, currently at 3.4 degrees per minute and climbing. What emergency procedure should we initiate for this scenario?","activate_protocol(protocol_id='MASA-SEC-003',scope='module_only')"
Q-00882,Radiation sensors in Tucán are reading 11.7 mSv/hr—what emergency response should we initiate? Commander Reyes just reported the spike.,"activate_protocol(protocol_id='MASA-SEC-004',scope='station_wide')"
Q-00883,Tucán temperature sensors showing a rise of 2.8 degrees per minute and climbing — should we log an alert?,"send_alert(module='tucan',severity='critical',reason='abnormal_temperature')"
Q-00885,Give me a quick rundown of the Kuntur Station's current mission and module layout before the next crew briefing.,no_action
Q-00887,Tucán temperature sensors showing a rapid rise of 4.1 degrees per minute—what emergency response should we initiate?,"activate_protocol(protocol_id='MASA-SEC-003',scope='module_only')"
Q-00888,Can you pull up the background details on Engineer Pavel Kozlov for the incoming crew briefing before the next shift change?,no_action
Q-00889,We need to calculate the optimal trajectory for Kuntur Station's planned reentry from 408 km LEO.,"calculate_trajectory(maneuver='reentry',urgency='planned')"
Q-00890,Jaguar oxygen concentration has dropped to 12.2%—Engineer Kozlov reports crew experiencing lightheadedness. What emergency steps should we initiate?,"activate_protocol(protocol_id='MASA-SEC-002',scope='station_wide')"
Q-00891,I need to log an alert — pressure sensors in Jaguar are showing 89.3 kPa and still dropping. What emergency procedure should we initiate for this situation?,"send_alert(module='jaguar',severity='high',reason='pressure_drop')"
Q-00892,Can we schedule a routine swap of the power cells in Jaguar during the next maintenance window?,"schedule_maintenance(module='jaguar',task='power_cell_swap',priority='routine')"
Q-00893,Radiation sensors in Vicuña are reading 2.1 mSv/hr and climbing; what emergency procedure do we initiate for this scenario?,"activate_protocol(protocol_id='MASA-SEC-012',scope='station_wide')"
Q-00894,Where is the crew currently located in Vicuña? I need to confirm their positions before the next cargo transfer.,"get_crew_status(module='vicuna',info='location')"
Q-00897,Tucán CO2 sensors hit 2.0% — crew reporting headaches. Kai Nakamura confirmed the reading. What emergency procedure should we follow for this?,"send_alert(module='tucan',severity='high',reason='oxygen_leak')"
Q-00898,Tucán temperature sensors showing a rise of 4.1 degrees per minute and climbing—should we flag this to Commander Reyes immediately?,"send_alert(module='tucan',severity='critical',reason='abnormal_temperature')"
Q-00899,Check Colibrí's life support status—Valdivia just reported unusual readings in her last comms check.,"get_module_status(module='colibri',system='life_support')"
Q-00900,Where is the medical officer currently located in Tucán? I need to confirm their status for the next shift handover.,"get_crew_status(module='tucan',info='location')"
Q-00901,Tucán pressure sensors are at 86.0 kPa and still dropping—what emergency response should we initiate?,"activate_protocol(protocol_id='MASA-SEC-011',scope='module_only')"
Q-00902,Vicuña O2 concentration just hit 14.0% and is still dropping—what emergency response should we initiate?,"send_alert(module='vicuna',severity='high',reason='oxygen_leak')"
Q-00903,Shut down the cooling system in Tucán immediately—Mendoza reports temperatures are rising.,"control_system(module='tucan',system='cooling',action='deactivate')"
Q-00904,Can we get a quick update on what the crew is currently doing in Vicuña?,"get_crew_status(module='vicuna',info='current_activity')"
Q-00905,I need to log an alert — Vicuña pressure sensors just hit 86.1 kPa and they’re still trending down.,"send_alert(module='vicuna',severity='high',reason='pressure_drop')"
Q-00906,Cóndor's oxygen concentration has dropped to 10.7%—should we flag this immediately? Commander Reyes just reported feeling lightheaded.,"send_alert(module='condor',severity='critical',reason='oxygen_leak')"
Q-00907,We need emergency resupply for scientific equipment—Quetzal just reported critical shortages that could halt ongoing experiments.,"request_supply(category='scientific',urgency='emergency')"
Q-00908,Dim the lighting in Quetzal by 20% to reduce glare during Specialist Nakamura's microscopy session.,"control_system(module='quetzal',system='lighting',action='decrease')"
Q-00909,We’re seeing a voltage fluctuation on Quetzal’s power bus—current reading is 99.1 V. What emergency procedure should we initiate for this?,"activate_protocol(protocol_id='MASA-SEC-018',scope='module_only')"
Q-00910,"We’ve got a CO₂ concentration of 2.3% in Quetzal, and crew is reporting headaches. What emergency procedure should we initiate for this situation?","activate_protocol(protocol_id='MASA-SEC-009',scope='module_only')"
Q-00912,I need to log an alert — Vicuña pressure sensors just hit 80.2 kPa and it’s still dropping. What emergency steps do we take?,"send_alert(module='vicuna',severity='critical',reason='pressure_drop')"
Q-00913,Increase heating in Colibrí to maintain optimal temperature for communications equipment.,"control_system(module='colibri',system='heating',action='increase')"
Q-00914,I need to log an alert — oxygen sensors in Quetzal are showing 14.0% concentration.,"send_alert(module='quetzal',severity='high',reason='oxygen_leak')"
Q-00915,"We’ve got a voltage fluctuation on Jaguar’s power bus, currently reading 102.4 V. Should we flag this for the team?","send_alert(module='jaguar',severity='medium',reason='power_fluctuation')"
Q-00916,Check the current health status of the crew member in Colibrí and report any issues immediately.,"get_crew_status(module='colibri',info='health')"
Q-00918,Tucán airlock equalization rate is showing 1.3 kPa per minute and still increasing—what emergency procedure should we initiate for this?,"activate_protocol(protocol_id='MASA-SEC-017',scope='module_only')"
Q-00919,Tucán power bus showing 130.6 V voltage fluctuation — Commander Reyes reports lights flickering. What emergency procedure covers this scenario?,"activate_protocol(protocol_id='MASA-SEC-018',scope='module_only')"
Q-00920,Radiation sensors in Jaguar are showing 2.5 mSv/hr and rising—what emergency response should we initiate?,"activate_protocol(protocol_id='MASA-SEC-012',scope='station_wide')"
Q-00922,Tucán pressure sensors are at 85.6 kPa and still dropping—what emergency response should we initiate?,"activate_protocol(protocol_id='MASA-SEC-011',scope='module_only')"
