id,query,tool_call
Q-02332,Cóndor's power bus is showing voltage fluctuations with a reading of 96.6 V—what emergency steps should we take for this scenario?,"activate_protocol(protocol_id='MASA-SEC-018',scope='module_only')"
Q-02333,We need emergency spare parts sent to Vicuña—systems are failing and backup components are critical.,"request_supply(category='spare_parts',urgency='emergency')"
Q-02334,"We’ve got a rapid pressure drop in Quetzal, currently reading 80.4 kPa—what emergency procedure should we initiate for this?","send_alert(module='quetzal',severity='critical',reason='pressure_drop')"
Q-02335,Can you pull up the full background profile for Commander Santiago Reyes before the next crew briefing?,no_action
Q-02336,Kai just reported Vicuña radiation sensors reading 4.0 mSv/hr—what emergency response should we initiate?,"send_alert(module='vicuna',severity='high',reason='radiation_spike')"
Q-02337,Cóndor's temperature is rising at 4.3 degrees per minute—what emergency procedure should we initiate? Commander Reyes just reported unusual heat in the command module.,"activate_protocol(protocol_id='MASA-SEC-003',scope='module_only')"
Q-02338,Oxygen concentration in Quetzal has dropped to 12.1% — Kai Nakamura just reported crew members are feeling lightheaded. What’s the next step here?,"send_alert(module='quetzal',severity='critical',reason='oxygen_leak')"
Q-02339,Cóndor pressure sensors are showing 85.3 kPa and declining — Commander Reyes has confirmed the reading. What emergency procedure should we initiate for this scenario?,"activate_protocol(protocol_id='MASA-SEC-011',scope='module_only')"
Q-02340,We’ve got a pressure anomaly in Quetzal—readings are at 86.5 kPa and still declining. What emergency steps do we need to take right now?,"activate_protocol(protocol_id='MASA-SEC-011',scope='module_only')"
Q-02341,I need to log an alert — pressure sensors in Jaguar are reading 85.0 kPa and still dropping. What emergency procedure should we initiate for this situation?,"send_alert(module='jaguar',severity='high',reason='pressure_drop')"
Q-02342,Jaguar oxygen concentration has dropped to 11.6%—what emergency procedure should we initiate? Engineer Kozlov just reported the crew is feeling lightheaded.,"activate_protocol(protocol_id='MASA-SEC-002',scope='station_wide')"
Q-02343,Vicuña temperature rate just spiked to 3.6 degrees per minute and still climbing—Commander Reyes wants to know if we should flag this for emergency response right now.,"send_alert(module='vicuna',severity='critical',reason='abnormal_temperature')"
Q-02344,We’ve got a pressure anomaly in Colibrí—readings are at 85.3 kPa and still declining. What emergency steps should we take for this situation?,"activate_protocol(protocol_id='MASA-SEC-011',scope='module_only')"
Q-02345,Cóndor's power bus is showing voltage fluctuations with a reading of 100.5 V since 0300 — what emergency procedure should we initiate?,"activate_protocol(protocol_id='MASA-SEC-018',scope='module_only')"
Q-02346,Where is Commander Reyes currently located in the Cóndor module?,"get_crew_status(module='condor',info='location')"
Q-02347,I need to log an alert — Vicuña temperature rate sensors are reading 4.0 degrees per minute and climbing.,"send_alert(module='vicuna',severity='critical',reason='abnormal_temperature')"
Q-02348,Can you give me a quick overview of Kuntur Station's current mission and module layout before the next shift change?,no_action
Q-02349,"I need to log an alert — radiation sensors in Jaguar are reading 4.0 mSv/hr, and Commander Reyes just reported possible increased solar activity.","send_alert(module='jaguar',severity='high',reason='radiation_spike')"
Q-02350,"We’ve got a rapid pressure drop in Colibrí, currently reading 75.4 kPa—what emergency procedure should we initiate for this?","send_alert(module='colibri',severity='critical',reason='pressure_drop')"
Q-02351,Cóndor hull stress sensors are reading 87.2% and climbing—Commander Reyes reports possible micrometeorite impact. What emergency steps should we take?,"send_alert(module='condor',severity='high',reason='structural_damage')"
Q-02352,Ana Valdivia just reported oxygen concentration in Colibrí is now at 14.6% and dropping—what emergency procedure should we initiate for this situation?,"activate_protocol(protocol_id='MASA-SEC-010',scope='module_only')"
Q-02353,Check the structural integrity status for the Jaguar module.,"get_module_status(module='jaguar',system='structural')"
Q-02354,Cóndor CO2 concentration has hit 2.9% and is climbing—crew reporting headaches. Should we escalate this to command?,"send_alert(module='condor',severity='high',reason='oxygen_leak')"
Q-02355,Check the current communications status in Jaguar—Kozlov mentioned static on the backup channel during his last update.,"get_module_status(module='jaguar',system='communications')"
Q-02356,"What’s the standard operational function of the Quetzal module, and how does it differ from the Jaguar module’s role?",no_action
Q-02357,Can you give me a quick overview of Kuntur Station's current mission and module layout before the next shift change?,no_action
Q-02358,Radiation sensors in Tucán are reading 9.2 mSv/hr and climbing—what emergency procedure do we initiate for this?,"activate_protocol(protocol_id='MASA-SEC-004',scope='station_wide')"
Q-02359,We need emergency food supplies sent to the station immediately—crew reports indicate critical shortages in Vicuña.,"request_supply(category='food',urgency='emergency')"
Q-02360,Airlock equalization rate in Colibrí is showing 0.9 kPa per minute and rising—what emergency procedure should we initiate for this scenario?,"activate_protocol(protocol_id='MASA-SEC-017',scope='module_only')"
Q-02361,We need to schedule an urgent power cell swap in Jaguar — get it on the maintenance log immediately.,"schedule_maintenance(module='jaguar',task='power_cell_swap',priority='urgent')"
Q-02362,Airlock equalization rate in Vicuña is at 0.7 kPa per minute—what emergency steps do we take for this scenario?,"activate_protocol(protocol_id='MASA-SEC-017',scope='module_only')"
Q-02363,We’ve got a rapid pressure drop in Jaguar—sensors just hit 82.4 kPa and still falling. Commander Reyes is reporting possible hull breach signs. What emergency steps do we initiate for this?,"send_alert(module='jaguar',severity='critical',reason='pressure_drop')"
Q-02364,"I need to log an alert — Quetzal's CO2 sensors are reading 2.8% and climbing, crew reporting headaches.","send_alert(module='quetzal',severity='high',reason='oxygen_leak')"
Q-02365,We’ve got a rapid pressure drop in Colibrí—sensors just hit 79.1 kPa and still falling. Commander Reyes is reporting possible hull breach symptoms. What emergency procedure do we initiate for this scenario?,"activate_protocol(protocol_id='MASA-SEC-001',scope='station_wide')"
Q-02366,Oxygen readings in Jaguar have dropped to 15.5% over the past 30 minutes—should we escalate this to the crew and command?,"send_alert(module='jaguar',severity='high',reason='oxygen_leak')"
Q-02368,Plot a debris avoidance trajectory for the station—ensure we have the updated orbital data before the next shift.,"calculate_trajectory(maneuver='debris_avoidance',urgency='planned')"
Q-02369,We’re getting reports from Lucía Mendoza that CO₂ concentration in Jaguar has hit 2.7% and crew members are complaining of headaches. What’s the appropriate emergency response procedure here?,"activate_protocol(protocol_id='MASA-SEC-009',scope='module_only')"
Q-02370,Jaguar hull stress sensors just spiked to 85.5% — Kai Nakamura reports possible micrometeorite impact. Do we flag this for immediate review?,"send_alert(module='jaguar',severity='high',reason='structural_damage')"
Q-02372,Generate the planned trajectory for an upcoming docking maneuver.,"calculate_trajectory(maneuver='docking',urgency='planned')"
Q-02373,Tucán radiation sensors are reading 1.2 mSv/hr and rising—what emergency response should we initiate?,"activate_protocol(protocol_id='MASA-SEC-012',scope='station_wide')"
Q-02375,Tucán oxygen concentration has dropped to 13.9% — what emergency procedure do we follow?,"send_alert(module='tucan',severity='critical',reason='oxygen_leak')"
Q-02376,"We’ve got a voltage fluctuation on Jaguar’s power bus, currently reading 132.4 V—what emergency procedure should we initiate for this?","activate_protocol(protocol_id='MASA-SEC-018',scope='module_only')"
Q-02377,Jaguar oxygen concentration has dropped to 15.1% over the past 30 minutes—should we escalate this to the command team?,"send_alert(module='jaguar',severity='high',reason='oxygen_leak')"
Q-02378,Oxygen readings in Colibrí have dropped to 15.6% and are still falling. Kai just reported it—what emergency steps should we take for this situation?,"activate_protocol(protocol_id='MASA-SEC-010',scope='module_only')"
Q-02379,Give me the temperature readings from Vicuña for the last hour.,"get_telemetry(module='vicuna',metric='temperature',timeframe_hours=1)"
Q-02380,We need an immediate trajectory calculation for the incoming docking maneuver—confirm parameters before the next shift change.,"calculate_trajectory(maneuver='docking',urgency='immediate')"
Q-02382,Pull the 24-hour power telemetry from Tucán for review—need to check for any irregularities.,"get_telemetry(module='tucan',metric='power',timeframe_hours=24)"
Q-02384,Kai just reported unusual fluctuations in Quetzal's experimental reactor—this needs to go directly to Specialist Nakamura for immediate review.,"send_message(recipient='specialist_1',priority='high')"
Q-02385,"Medical Officer Mendoza, urgent message incoming—crew vitals from Tucán are showing irregular patterns during the last sleep cycle. Need immediate review.","send_message(recipient='medical_officer',priority='urgent')"
Q-02386,We've got a fuel emergency on our hands—request an immediate supply drop to Kuntur Station.,"request_supply(category='fuel',urgency='emergency')"
Q-02387,Can someone give me a quick overview of the current scientific research program running in the Quetzal module?,no_action
Q-02389,Check the inventory for spare communication equipment and submit a routine resupply request if stock is low.,"request_supply(category='equipment',urgency='routine')"
Q-02391,What’s the current schedule for the crew working in Quetzal? I need to coordinate with Specialist Nakamura for the upcoming experiment.,"get_crew_status(module='quetzal',info='schedule')"
Q-02392,Pull the temperature readings from Colibrí for the last 12 hours and display the trend.,"get_telemetry(module='colibri',metric='temperature',timeframe_hours=12)"
Q-02393,"We need an immediate trajectory calculation for an orbit adjustment—station altitude is 408 km LEO, and this can't wait.","calculate_trajectory(maneuver='orbit_adjustment',urgency='immediate')"
Q-02394,Tucán oxygen concentration has dropped to 13.4% — Engineer Kozlov reports crew is experiencing lightheadedness. What emergency steps do we initiate?,"activate_protocol(protocol_id='MASA-SEC-002',scope='station_wide')"
Q-02395,Tucán oxygen concentration has dropped to 10.6% — what emergency procedure do we follow?,"send_alert(module='tucan',severity='critical',reason='oxygen_leak')"
Q-02396,Check Colibrí's power status and confirm all comms systems are within nominal parameters.,"get_module_status(module='colibri',system='power')"
Q-02397,Water recycling in Vicuña has dropped to 37.5% and it's been degrading for hours—what emergency procedure should we initiate for this?,"activate_protocol(protocol_id='MASA-SEC-015',scope='station_wide')"
Q-02399,Cóndor CO2 concentration has hit 2.9% and is climbing—Reyes reports crew headaches. What emergency procedure should we initiate for this?,"activate_protocol(protocol_id='MASA-SEC-009',scope='module_only')"
Q-02401,Biological contamination alarm just triggered in Quetzal—readings are showing contamination reported. What emergency response should we initiate?,"activate_protocol(protocol_id='MASA-SEC-019',scope='module_only')"
Q-02404,Radiation sensors in Vicuña are reading 10.4 mSv/hr—what emergency response should we initiate? Commander Reyes just reported the spike.,"activate_protocol(protocol_id='MASA-SEC-004',scope='station_wide')"
Q-02405,Water recycling in Jaguar is down to 34.6% and has been dropping for hours—what emergency steps do we take for this scenario?,"activate_protocol(protocol_id='MASA-SEC-015',scope='station_wide')"
Q-02406,Shut down the ventilation system in Cóndor—commander reports unusual airflow patterns during checks.,"control_system(module='condor',system='ventilation',action='deactivate')"
Q-02407,We need an immediate trajectory calculation for the incoming docking maneuver—confirm parameters before the next shift change.,"calculate_trajectory(maneuver='docking',urgency='immediate')"
Q-02409,Where are Nakamura and Al-Hassan currently located in Quetzal?,"get_crew_status(module='quetzal',info='location')"
Q-02410,Schedule routine filter replacement in Colibrí—Pilot Valdivia noted the maintenance is due during her last system check.,"schedule_maintenance(module='colibri',task='filter_replacement',priority='routine')"
Q-02411,Can we get the current crew schedule for activities happening in the Jaguar module?,"get_crew_status(module='jaguar',info='schedule')"
Q-02412,Check the current health status of all crew members in Vicuña for the shift report.,"get_crew_status(module='vicuna',info='health')"
Q-02413,Pull the last 12 hours of pressure data from Vicuña for the shift review.,"get_telemetry(module='vicuna',metric='pressure',timeframe_hours=12)"
Q-02415,Oxygen concentration in Quetzal has dropped to 13.9% — Kai Nakamura reports dizziness. What emergency procedure should we initiate?,"activate_protocol(protocol_id='MASA-SEC-002',scope='station_wide')"
Q-02416,"Ana Valdivia just reported headaches from Colibrí, CO2 concentration climbing to 1.9%—what emergency procedure should we initiate for this?","activate_protocol(protocol_id='MASA-SEC-009',scope='module_only')"
Q-02417,Activate ventilation in Colibrí module immediately—Pilot Valdivia reports elevated temperature readings.,"control_system(module='colibri',system='ventilation',action='activate')"
Q-02418,Jaguar's CO2 scrubber efficiency is down to 32.3% and still dropping—what emergency procedure should we initiate for this?,"activate_protocol(protocol_id='MASA-SEC-014',scope='station_wide')"
Q-02420,Notify all crew that the station-wide maintenance schedule has been updated for the next cycle.,"send_message(recipient='all_crew',priority='low')"
Q-02421,We need to calculate the reentry trajectory immediately—station altitude is 408 km and dropping.,"calculate_trajectory(maneuver='reentry',urgency='immediate')"
Q-02424,Tucán pressure sensors are at 87.1 kPa and still dropping—what emergency response should we initiate?,"activate_protocol(protocol_id='MASA-SEC-011',scope='module_only')"
Q-02425,Radiation sensors in Jaguar are showing 2.4 mSv/hr and rising—what emergency response should we initiate?,"send_alert(module='jaguar',severity='high',reason='radiation_spike')"
Q-02426,Can we get the current crew schedule for Tucán? Lucía Mendoza just asked for a quick update.,"get_crew_status(module='tucan',info='schedule')"
Q-02428,Notify Fatima Al-Hassan about the scheduled calibration for Quetzal’s spectroscopy equipment—she’ll need to prep the lab before the next shift.,"send_message(recipient='specialist_2',priority='medium')"
Q-02429,We’ve got a rapid pressure drop in Jaguar—sensors just hit 73.4 kPa and still falling. Commander Reyes reports possible hull breach. What emergency procedure do we initiate here?,"activate_protocol(protocol_id='MASA-SEC-001',scope='station_wide')"
Q-02430,Check the current power status in Cóndor—Commander Reyes just flagged a voltage fluctuation during the last system check.,"get_module_status(module='condor',system='power')"
Q-02432,Notify Fatima Al-Hassan about the scheduled calibration for Quetzal’s spectroscopy equipment—ensure she acknowledges before the next shift change.,"send_message(recipient='specialist_2',priority='medium')"
Q-02433,Radiation sensors in Quetzal are reading 3.8 mSv/hr and rising—should we escalate this to command?,"send_alert(module='quetzal',severity='high',reason='radiation_spike')"
Q-02434,Cóndor CO2 concentration has hit 1.8% and is climbing—crew reporting headaches. Should we escalate this to command?,"send_alert(module='condor',severity='high',reason='oxygen_leak')"
Q-02435,Can you confirm the primary function of the Quetzal module for the incoming crew briefing before the next shift change?,no_action
Q-02436,"Cóndor module is showing CO2 concentration at 2.9% and climbing, crew reports headaches. What emergency steps should we take for this scenario?","activate_protocol(protocol_id='MASA-SEC-009',scope='module_only')"
Q-02437,We need urgent sensor repair in Colibrí—Valdivia reports comms systems are degrading. Schedule this as top priority.,"schedule_maintenance(module='colibri',task='sensor_repair',priority='urgent')"
Q-02438,Kozlov just reported fuel reserves are critical—we need an emergency resupply to Kuntur Station immediately.,"request_supply(category='fuel',urgency='emergency')"
Q-02439,Can we get a quick update on what Valdivia is currently working on in Colibrí?,"get_crew_status(module='colibri',info='current_activity')"
Q-02440,Airlock equalization rate in Colibrí is climbing at 1.3 kPa per minute—what emergency procedure should we initiate for this scenario?,"activate_protocol(protocol_id='MASA-SEC-017',scope='module_only')"
Q-02441,I need to log an alert — Vicuña temperature rate sensors are reading 2.7 degrees per minute and climbing. What emergency procedure should we initiate for this situation?,"send_alert(module='vicuna',severity='critical',reason='abnormal_temperature')"
Q-02442,Cóndor radiation sensors are showing 2.9 mSv/hr—what emergency procedure should we follow?,"activate_protocol(protocol_id='MASA-SEC-012',scope='station_wide')"
Q-02443,Vicuña hull stress sensors just hit 89.6%—Commander Reyes reports a potential micrometeorite impact. What emergency procedure should we initiate?,"activate_protocol(protocol_id='MASA-SEC-008',scope='module_only')"
Q-02444,Hull stress readings in Quetzal have hit 93.3% — Kai Nakamura just reported possible micrometeorite impact. What emergency steps do we initiate?,"send_alert(module='quetzal',severity='high',reason='structural_damage')"
Q-02445,Vicuña pressure just dropped to 83.1 kPa and is still falling—Commander Reyes reports a possible hull breach. What emergency steps do we initiate right now?,"send_alert(module='vicuna',severity='critical',reason='pressure_drop')"
Q-02446,Vicuña pressure just dropped to 73.1 kPa and is still falling—what emergency response should we initiate? Commander Reyes is already moving the crew to Cóndor.,"activate_protocol(protocol_id='MASA-SEC-001',scope='station_wide')"
Q-02447,Tucán CO2 sensors are reading 2.8% and climbing — crew reporting headaches. Should we escalate this to command?,"send_alert(module='tucan',severity='high',reason='oxygen_leak')"
Q-02448,Radiation sensors in Vicuña are reading 6.8 mSv/hr and climbing—what emergency procedure do we initiate for this?,"activate_protocol(protocol_id='MASA-SEC-004',scope='station_wide')"
Q-02449,Tucán oxygen concentration has dropped to 14.2% and is still falling — what emergency procedure do we initiate?,"activate_protocol(protocol_id='MASA-SEC-010',scope='module_only')"
Q-02450,Can you give me a quick overview of MASA's mission history and the main objectives for the current Cóndor-7 mission?,no_action
Q-02451,We’ve got a pressure anomaly in Colibrí—readings are at 86.0 kPa and still declining. What emergency steps should we take for this situation?,"send_alert(module='colibri',severity='high',reason='pressure_drop')"
Q-02452,Cóndor hull stress sensors are reading 91.1%—Commander Reyes reports a potential micrometeorite impact. What emergency procedure should we initiate?,"activate_protocol(protocol_id='MASA-SEC-008',scope='module_only')"
Q-02453,Can we schedule a routine software update for Tucán during the next maintenance window?,"schedule_maintenance(module='tucan',task='software_update',priority='routine')"
Q-02454,Kai just reported Jaguar radiation sensors at 3.2 mSv/hr and rising — should we log an alert?,"send_alert(module='jaguar',severity='high',reason='radiation_spike')"
Q-02456,We’ve got a pressure anomaly in Colibrí—readings are at 88.6 kPa and still declining. What emergency steps should we initiate for this situation?,"activate_protocol(protocol_id='MASA-SEC-011',scope='module_only')"
Q-02457,Notify all crew immediately—Kuntur Station is transitioning to emergency power reserves across all modules.,"send_message(recipient='all_crew',priority='high')"
Q-02458,Oxygen readings in Vicuña just dropped to 14.4% and still falling — should we log an alert on this?,"send_alert(module='vicuna',severity='high',reason='oxygen_leak')"
Q-02459,Radiation sensors in Quetzal are reading 1.3 mSv/hr and rising—should we escalate this to command?,"send_alert(module='quetzal',severity='medium',reason='radiation_spike')"
Q-02460,Can we get a quick reminder to all crew about the upcoming maintenance checks scheduled for this evening?,"send_message(recipient='all_crew',priority='low')"
Q-02461,Kai just reported Vicuña radiation sensors reading 4.3 mSv/hr — what emergency response should we initiate?,"send_alert(module='vicuna',severity='high',reason='radiation_spike')"
Q-02462,Check the structural integrity status for the Quetzal module before the next science shift.,"get_module_status(module='quetzal',system='structural')"
Q-02464,"I need to log an alert — Vicuña CO2 sensors are reading 2.3% and climbing, crew reports headaches. What emergency steps do we take?","send_alert(module='vicuna',severity='high',reason='oxygen_leak')"
Q-02465,Schedule a routine maintenance task for Quetzal—swap out the power cells during the next available window.,"schedule_maintenance(module='quetzal',task='power_cell_swap',priority='routine')"
Q-02466,We need an immediate trajectory calculation for an orbit adjustment—station altitude is 408 km LEO. What's the optimal burn profile to execute this maneuver safely?,"calculate_trajectory(maneuver='orbit_adjustment',urgency='immediate')"
Q-02467,Radiation sensors in Jaguar are showing 9.3 mSv/hr and rising—what emergency response should we initiate?,"activate_protocol(protocol_id='MASA-SEC-004',scope='station_wide')"
Q-02468,Cóndor's CO2 sensors are reading 1.9% and climbing — Commander Reyes reports crew headaches. Should we escalate this?,"send_alert(module='condor',severity='high',reason='oxygen_leak')"
Q-02469,Fatima just reported headaches in Vicuña—CO2 sensors are reading 2.3% and climbing. Should we flag this to Commander Reyes immediately?,"send_alert(module='vicuna',severity='high',reason='oxygen_leak')"
Q-02470,We’ve got a rapid temperature rise in Quetzal—sensors showing 4.5 degrees per minute and climbing. What emergency procedure do we initiate for this scenario?,"activate_protocol(protocol_id='MASA-SEC-003',scope='module_only')"
Q-02471,Schedule a routine hull inspection for the Vicuña module during the next maintenance window.,"schedule_maintenance(module='vicuna',task='hull_inspection',priority='routine')"
Q-02473,What is the primary operational function of the Quetzal module?,no_action
Q-02474,Tucán radiation sensors are at 3.4 mSv/hr and rising—what emergency response should we initiate? Commander Reyes reports solar activity may be increasing.,"activate_protocol(protocol_id='MASA-SEC-012',scope='station_wide')"
Q-02475,Tucán power bus showing 134.9 V voltage fluctuation — should we log an alert?,"send_alert(module='tucan',severity='medium',reason='power_fluctuation')"
Q-02476,Radiation sensors in Vicuña are reading 6.4 mSv/hr and climbing—what emergency procedure do we initiate for this?,"activate_protocol(protocol_id='MASA-SEC-004',scope='station_wide')"
Q-02477,Water recycling in Vicuña has dropped to 24.3% and been degrading for hours. What emergency steps should we take for this scenario?,"activate_protocol(protocol_id='MASA-SEC-015',scope='station_wide')"
Q-02478,We’ve got a voltage fluctuation in Quetzal—power bus sensors just hit 139.8 V and holding. What emergency steps do we need to take on this?,"activate_protocol(protocol_id='MASA-SEC-018',scope='module_only')"
Q-02479,Cóndor's temperature is rising at 3.9 degrees per minute—should we flag this immediately or run diagnostics first? Commander Reyes is monitoring the readings now.,"send_alert(module='condor',severity='critical',reason='abnormal_temperature')"
Q-02481,Medical Officer Mendoza just reported an urgent software update needed in Tucán—can we schedule this immediately?,"schedule_maintenance(module='tucan',task='software_update',priority='urgent')"
Q-02482,Can we get the trajectory calculations for the planned orbit adjustment before the next shift?,"calculate_trajectory(maneuver='orbit_adjustment',urgency='planned')"
Q-02483,Oxygen concentration in Quetzal has dropped to 10.6% — Kai Nakamura reports dizziness. What emergency procedure should we initiate?,"activate_protocol(protocol_id='MASA-SEC-002',scope='station_wide')"
Q-02484,We’ve got a pressure anomaly in Vicuña—readings just hit 85.3 kPa and still dropping. What emergency procedure should we initiate for this scenario?,"activate_protocol(protocol_id='MASA-SEC-011',scope='module_only')"
Q-02485,Schedule a routine software update for the Vicuña module during the next maintenance window.,"schedule_maintenance(module='vicuna',task='software_update',priority='routine')"
