id,query,tool_call
Q-01539,Cóndor radiation sensors just spiked to 9.1 mSv/hr — Commander Reyes is reporting this now. How should we handle this situation?,"send_alert(module='condor',severity='critical',reason='radiation_spike')"
Q-01540,Check spare parts inventory and submit a routine resupply request for maintenance stock.,"request_supply(category='spare_parts',urgency='routine')"
Q-01541,"Can you pull up the training records for the current crew, specifically their emergency response drills from the last quarter?",no_action
Q-01542,Deactivate heating in Colibrí—temperature readings are above nominal and climbing.,"control_system(module='colibri',system='heating',action='deactivate')"
Q-01543,Tucán pressure sensors are at 87.3 kPa and still dropping—what emergency response should we initiate?,"send_alert(module='tucan',severity='high',reason='pressure_drop')"
Q-01544,Vicuña power bus voltage just hit 139.4 V—what emergency procedure covers this fluctuation?,"activate_protocol(protocol_id='MASA-SEC-018',scope='module_only')"
Q-01545,What is the official mission patch design for MASA's Cóndor-7 mission?,no_action
Q-01546,Kai Nakamura just reported CO2 concentration in Jaguar has hit 2.4% and is still climbing—crew is complaining of headaches. What’s the next step here?,"send_alert(module='jaguar',severity='high',reason='oxygen_leak')"
Q-01547,Tucán pressure sensors just hit 83.4 kPa and still dropping—what emergency response should we initiate? Commander Reyes reports possible hull breach sound.,"activate_protocol(protocol_id='MASA-SEC-001',scope='station_wide')"
Q-01548,Oxygen concentration in Quetzal is reading 15.2% and still dropping — what emergency procedure do we initiate? Specialist Nakamura reported the trend started about 30 minutes ago.,"activate_protocol(protocol_id='MASA-SEC-010',scope='module_only')"
Q-01549,"We’re seeing a rapid temperature rise in Colibrí, currently at 2.2 degrees per minute and climbing. What emergency procedure should we initiate for this situation?","activate_protocol(protocol_id='MASA-SEC-003',scope='module_only')"
Q-01550,Oxygen concentration in Quetzal is at 15.5% and still dropping — what emergency procedure do we initiate?,"activate_protocol(protocol_id='MASA-SEC-010',scope='module_only')"
Q-01551,Oxygen concentration in Quetzal just dropped to 11.5%—what emergency response should we initiate for this scenario?,"activate_protocol(protocol_id='MASA-SEC-002',scope='station_wide')"
Q-01552,Pull the 24-hour humidity readings from Quetzal for review.,"get_telemetry(module='quetzal',metric='humidity',timeframe_hours=24)"
Q-01555,Cóndor's power bus showing 134.1 V fluctuation—what emergency procedure covers this voltage reading?,"activate_protocol(protocol_id='MASA-SEC-018',scope='module_only')"
Q-01556,Pressure in Vicuña is holding at 89.9 kPa but has been declining steadily—what emergency steps should we take for this scenario?,"activate_protocol(protocol_id='MASA-SEC-011',scope='module_only')"
Q-01557,Kai just reported Jaguar's temperature is rising at 3.7 degrees per minute—what emergency response should we initiate?,"activate_protocol(protocol_id='MASA-SEC-003',scope='module_only')"
Q-01560,Bump up the heating in Tucán—Mendoza just reported the temperature is dropping below normal.,"control_system(module='tucan',system='heating',action='increase')"
Q-01562,Cóndor's CO2 sensors are reading 1.7% and climbing — Commander Reyes reports crew headaches. What emergency procedure should we initiate for this?,"send_alert(module='condor',severity='high',reason='oxygen_leak')"
Q-01563,Check the current communications status in Cóndor—Reyes just reported intermittent static on the command channel.,"get_module_status(module='condor',system='communications')"
Q-01565,Jaguar hull stress sensors just spiked to 88.3% — Kai Nakamura reports possible micrometeorite impact. What emergency steps do we initiate?,"activate_protocol(protocol_id='MASA-SEC-008',scope='module_only')"
Q-01566,Activate the ventilation system in Jaguar module immediately.,"control_system(module='jaguar',system='ventilation',action='activate')"
Q-01567,Jaguar's CO2 scrubber efficiency is down to 53.0% and still dropping—what emergency procedure should we initiate for this?,"activate_protocol(protocol_id='MASA-SEC-014',scope='station_wide')"
Q-01568,Cóndor's power grid is at 97.3% capacity with stress indicators—how should we proceed with emergency measures?,"send_alert(module='condor',severity='critical',reason='power_fluctuation')"
Q-01569,Kai Nakamura just reported CO2 concentration in Quetzal is at 2.8% and rising—crew has headaches. What emergency steps do we take?,"activate_protocol(protocol_id='MASA-SEC-009',scope='module_only')"
Q-01570,Pull the last six hours of power telemetry from Cóndor for the shift review.,"get_telemetry(module='condor',metric='power',timeframe_hours=6)"
Q-01571,We need to schedule an urgent power cell swap in Vicuña.,"schedule_maintenance(module='vicuna',task='power_cell_swap',priority='urgent')"
Q-01572,Tucán radiation sensors are showing 11.3 mSv/hr and climbing — what emergency procedure do we run?,"activate_protocol(protocol_id='MASA-SEC-004',scope='station_wide')"
Q-01573,Notify Specialist Nakamura that the sample analysis from Quetzal is ready for review when he has a moment.,"send_message(recipient='specialist_1',priority='low')"
Q-01574,Water recycling in Vicuña has dropped to 21.8% and been degrading for hours — what’s the emergency procedure for this scenario?,"activate_protocol(protocol_id='MASA-SEC-015',scope='station_wide')"
Q-01576,Give me the radiation levels in Colibrí for the past six hours—Valdivia noted some interference during the last comms pass.,"get_telemetry(module='colibri',metric='radiation',timeframe_hours=6)"
Q-01577,Tucán oxygen concentration has dropped to 15.8% and is still falling — should we log an alert for this?,"send_alert(module='tucan',severity='high',reason='oxygen_leak')"
Q-01579,We’ve got a voltage fluctuation on Quetzal’s power bus—sensors just hit 133.5 V and still fluctuating. Fatima flagged it during her systems check. Should we escalate this to command?,"send_alert(module='quetzal',severity='medium',reason='power_fluctuation')"
Q-01580,Check the medical supply inventory in Vicuña—we need to restock routine items before the next cargo delivery.,"request_supply(category='medical',urgency='routine')"
Q-01581,We've lost all ground contact through Colibrí—blackout now at 67 minutes and counting. What emergency steps should we initiate for this communication failure?,"send_alert(module='colibri',severity='high',reason='communication_loss')"
Q-01583,Cóndor pressure sensors are showing 87.6 kPa and declining — Commander Reyes just confirmed. What emergency steps should we take for this scenario?,"activate_protocol(protocol_id='MASA-SEC-011',scope='module_only')"
Q-01586,Oxygen concentration in Vicuña has dropped to 10.9% and is still falling—what emergency steps should we take for this scenario?,"activate_protocol(protocol_id='MASA-SEC-002',scope='station_wide')"
Q-01587,Cóndor airlock equalization rate is reading 1.2 kPa per minute—what emergency response should we initiate?,"activate_protocol(protocol_id='MASA-SEC-017',scope='module_only')"
Q-01589,Can you confirm the primary operational objectives of MASA's Kuntur Station and the roles of each module in the current Cóndor-7 mission?,no_action
Q-01590,Kai Nakamura just reported CO2 concentration in Quetzal is at 2.4% and rising—crew has headaches. Do we flag this for command?,"send_alert(module='quetzal',severity='high',reason='oxygen_leak')"
Q-01591,"Where is Commander Reyes currently, and what is he doing in Cóndor module?","get_crew_status(module='condor',info='current_activity')"
Q-01592,Ana Valdivia just reported oxygen concentration in Colibrí is down to 15.2% and still dropping—what emergency procedure should we initiate for this?,"activate_protocol(protocol_id='MASA-SEC-010',scope='module_only')"
Q-01593,I need to initiate emergency response — Vicuña pressure sensors just hit 87.9 kPa and continue dropping.,"activate_protocol(protocol_id='MASA-SEC-011',scope='module_only')"
Q-01594,Cóndor's oxygen concentration has dropped to 14.2% and is still falling—Commander Reyes just reported it. What emergency steps should we initiate for this situation?,"activate_protocol(protocol_id='MASA-SEC-010',scope='module_only')"
Q-01595,"Radiation sensors in Quetzal are reading 3.8 mSv/hr, and solar activity reports suggest it may increase. What emergency procedure should we initiate for this scenario?","activate_protocol(protocol_id='MASA-SEC-012',scope='station_wide')"
Q-01598,I need to log an alert — pressure sensors in Colibrí are showing 88.8 kPa and still declining. What emergency steps should we take for this situation?,"send_alert(module='colibri',severity='high',reason='pressure_drop')"
Q-01599,Cóndor radiation sensors are showing 2.9 mSv/hr—should we flag this up the chain given the current solar activity?,"send_alert(module='condor',severity='high',reason='radiation_spike')"
Q-01600,Tucán oxygen concentration has dropped to 13.4% — Engineer Kozlov reports crew is experiencing lightheadedness. What emergency steps do we take?,"send_alert(module='tucan',severity='critical',reason='oxygen_leak')"
Q-01601,I need to log an alert — Vicuña temperature rate sensors are reading 4.1 degrees per minute and climbing. What emergency procedure should we initiate for this situation?,"send_alert(module='vicuna',severity='critical',reason='abnormal_temperature')"
Q-01602,Can you pull up the crew profile for Engineer Pavel Kozlov for the mission briefing?,no_action
Q-01603,We need emergency equipment resupply — Quetzal's backup systems are failing and replacements must be sent on the next available transport.,"request_supply(category='equipment',urgency='emergency')"
Q-01604,We’ve got a pressure anomaly in Jaguar—sensors just hit 86.6 kPa and it’s still trending down. What’s the emergency procedure for this?,"activate_protocol(protocol_id='MASA-SEC-011',scope='module_only')"
Q-01606,Tucán CO2 sensors hit 2.5% — crew reporting headaches. What emergency response do we need here?,"activate_protocol(protocol_id='MASA-SEC-009',scope='module_only')"
Q-01607,Notify Fatima Al-Hassan about the scheduled calibration for Quetzal's spectral analyzers before the next shift.,"send_message(recipient='specialist_2',priority='medium')"
Q-01608,Increase ventilation in Cóndor to maintain optimal temperature levels for the commander.,"control_system(module='condor',system='ventilation',action='increase')"
Q-01609,"Check the life support status in Vicuña—need current readings for temperature, pressure, and oxygen.","get_module_status(module='vicuna',system='life_support')"
Q-01610,Notify Commander Reyes that the latest cargo manifest update from Vicuña is ready for his review when he's available.,"send_message(recipient='commander',priority='low')"
Q-01611,Pull the temperature readings from Tucán for the last six hours.,"get_telemetry(module='tucan',metric='temperature',timeframe_hours=6)"
Q-01612,Cóndor pressure sensors just dropped to 85.1 kPa and are still falling — should we flag this to Commander Reyes immediately?,"send_alert(module='condor',severity='high',reason='pressure_drop')"
Q-01613,Check the structural integrity status for Cóndor module—commander just flagged a possible anomaly during the last system review.,"get_module_status(module='condor',system='structural')"
Q-01614,Can we get the current status of the communications system in Quetzal? Nakamura mentioned some irregularities during his last check.,"get_module_status(module='quetzal',system='communications')"
Q-01615,Check the life support systems in Jaguar and give me a status report—Kozlov’s last update mentioned a pressure anomaly.,"get_module_status(module='jaguar',system='life_support')"
Q-01616,Activate the filtration system in Quetzal—Nakamura just reported elevated particulate levels during the latest experiment.,"control_system(module='quetzal',system='filtration',action='activate')"
Q-01617,I need to log an alert — Vicuña pressure sensors just hit 74.7 kPa and still dropping. What emergency procedure covers this?,"send_alert(module='vicuna',severity='critical',reason='pressure_drop')"
Q-01619,Check the structural integrity status in Quetzal—Nakamura flagged possible hull stress anomalies during the last experiment cycle.,"get_module_status(module='quetzal',system='structural')"
Q-01620,"Ana Valdivia just reported headaches from Colibrí, CO2 concentration climbing to 2.6%—should we log this as an alert?","send_alert(module='colibri',severity='high',reason='oxygen_leak')"
Q-01621,We’re seeing elevated radiation in Jaguar at 1.1 mSv/hr and rising—solar activity’s picking up. What emergency steps should we take for this scenario?,"activate_protocol(protocol_id='MASA-SEC-012',scope='station_wide')"
Q-01623,Tucán oxygen concentration has dropped to 14.5% and is still falling — should we flag this to Commander Reyes immediately?,"send_alert(module='tucan',severity='high',reason='oxygen_leak')"
Q-01624,Bump up the cooling in Tucán—Mendoza just reported temperatures climbing out of nominal range.,"control_system(module='tucan',system='cooling',action='increase')"
Q-01625,Cóndor oxygen concentration just dropped to 15.8% and is still falling—what emergency response should we initiate?,"send_alert(module='condor',severity='high',reason='oxygen_leak')"
Q-01626,Airlock equalization rate in Vicuña is now at 1.2 kPa per minute and rising—what emergency procedure should we initiate for this scenario?,"activate_protocol(protocol_id='MASA-SEC-017',scope='module_only')"
Q-01627,Can we get the current thermal status of Quetzal before the next experiment cycle?,"get_module_status(module='quetzal',system='thermal')"
Q-01628,Schedule routine system calibration for Jaguar module during the next maintenance window.,"schedule_maintenance(module='jaguar',task='system_calibration',priority='routine')"
Q-01629,Vicuña power bus voltage just hit 134.7 V—what emergency procedure covers this kind of fluctuation?,"activate_protocol(protocol_id='MASA-SEC-018',scope='module_only')"
Q-01630,Cóndor's power grid is at 97.3% capacity with climbing readings—what emergency response should we initiate? Commander Reyes reports flickering lights in Quetzal.,"activate_protocol(protocol_id='MASA-SEC-006',scope='station_wide')"
Q-01631,We've lost all contact with Colibrí for 67 minutes—what emergency procedure covers this kind of communications blackout?,"activate_protocol(protocol_id='MASA-SEC-007',scope='station_wide')"
Q-01632,"What’s the current schedule for the crew in Cóndor, and are they on track with today’s tasks?","get_crew_status(module='condor',info='schedule')"
Q-01633,Radiation sensors in Tucán are reading 11.9 mSv/hr—what emergency response should we initiate? Commander Reyes just reported the spike.,"activate_protocol(protocol_id='MASA-SEC-004',scope='station_wide')"
Q-01634,Water recycling in Jaguar is showing sustained degradation—readings just hit 32.0% and have been dropping for hours. What emergency steps do we need to take for this?,"activate_protocol(protocol_id='MASA-SEC-015',scope='station_wide')"
Q-01635,Cóndor pressure sensors just dropped to 80.1 kPa—Reyes is reporting a possible hull breach. How should we handle this?,"send_alert(module='condor',severity='critical',reason='pressure_drop')"
Q-01637,Can we schedule a routine software update for Cóndor during the next maintenance window?,"schedule_maintenance(module='condor',task='software_update',priority='routine')"
Q-01638,Hull stress sensors in Colibrí are showing 87.8% — Kai Nakamura just reported possible micrometeorite impact. What emergency procedure do we initiate?,"activate_protocol(protocol_id='MASA-SEC-008',scope='module_only')"
Q-01639,Tucán power bus showing voltage fluctuations—current reading at 103.7 V. What emergency steps do we take for this scenario?,"activate_protocol(protocol_id='MASA-SEC-018',scope='module_only')"
Q-01640,Check the current communications system status in Tucán—Mendoza just reported intermittent static on the medical bay console.,"get_module_status(module='tucan',system='communications')"
Q-01641,Pull the last 12 hours of humidity data from Tucán for the environmental report.,"get_telemetry(module='tucan',metric='humidity',timeframe_hours=12)"
Q-01642,Tucán pressure sensors just hit 76.0 kPa and are still falling — Fatima Al-Hassan reported a possible hull breach. What emergency procedure do we initiate here?,"send_alert(module='tucan',severity='critical',reason='pressure_drop')"
Q-01643,Radiation sensors in Vicuña are reading 8.7 mSv/hr and climbing — should we flag this to Commander Reyes immediately?,"send_alert(module='vicuna',severity='critical',reason='radiation_spike')"
Q-01645,I need to log an alert — Quetzal pressure sensors are reading 89.7 kPa and declining since 0300. What emergency procedure applies here?,"send_alert(module='quetzal',severity='high',reason='pressure_drop')"
Q-01646,Pull the last hour of temperature telemetry from Tucán for review.,"get_telemetry(module='tucan',metric='temperature',timeframe_hours=1)"
Q-01648,"We’ve got a rapid pressure drop in Colibrí, currently reading 84.0 kPa—what emergency procedure should we initiate for this scenario?","activate_protocol(protocol_id='MASA-SEC-001',scope='station_wide')"
Q-01649,Radiation sensors in Vicuña are reading 10.4 mSv/hr—what emergency response should we initiate?,"send_alert(module='vicuna',severity='critical',reason='radiation_spike')"
Q-01650,Check the current thermal status in Tucán—Mendoza mentioned the med bay feels warmer than usual during her last report.,"get_module_status(module='tucan',system='thermal')"
Q-01651,Cóndor hull stress sensors just hit 88.0%—Commander Reyes reports a potential micrometeorite impact. What emergency procedure should we initiate?,"activate_protocol(protocol_id='MASA-SEC-008',scope='module_only')"
Q-01653,We need urgent sensor repair in Quetzal – schedule it now.,"schedule_maintenance(module='quetzal',task='sensor_repair',priority='urgent')"
Q-01654,Tucán pressure just dropped to 84.9 kPa—what emergency procedure do we follow?,"activate_protocol(protocol_id='MASA-SEC-001',scope='station_wide')"
Q-01655,We need emergency equipment resupply to address an urgent hardware failure.,"request_supply(category='equipment',urgency='emergency')"
Q-01656,I need to log an alert — oxygen sensors in Jaguar just hit 13.9% and are still dropping. Crew may be affected. What steps do we take?,"send_alert(module='jaguar',severity='critical',reason='oxygen_leak')"
Q-01657,We’ve got a pressure differential at Vicuña’s docking port reading 5.2 kPa during active docking—what emergency procedure should we initiate for this scenario?,"activate_protocol(protocol_id='MASA-SEC-013',scope='module_only')"
Q-01658,Water recycling in Vicuña has dropped to 27.1% and been degrading for hours — what’s the emergency procedure for this scenario?,"activate_protocol(protocol_id='MASA-SEC-015',scope='station_wide')"
Q-01659,Radiation sensors in Colibrí are reading 6.5 mSv/hr and rising—what emergency steps do we take for this scenario? Fatima flagged it during her systems check.,"activate_protocol(protocol_id='MASA-SEC-004',scope='station_wide')"
Q-01660,Give me the radiation levels in Tucán for the last six hours.,"get_telemetry(module='tucan',metric='radiation',timeframe_hours=6)"
Q-01662,Cóndor's oxygen concentration has dropped to 15.6% and is still falling—Commander Reyes just reported it. What emergency steps should we initiate for this situation?,"activate_protocol(protocol_id='MASA-SEC-010',scope='module_only')"
Q-01663,Can you confirm the primary research objectives for the current scientific program onboard Quetzal?,no_action
Q-01666,Radiation sensors in Quetzal are reading 7.9 mSv/hr—what emergency response should we initiate?,"activate_protocol(protocol_id='MASA-SEC-004',scope='station_wide')"
Q-01667,I need to log an alert — Vicuña oxygen concentration just hit 14.5% and it's still dropping. What emergency procedure should we follow for this?,"send_alert(module='vicuna',severity='high',reason='oxygen_leak')"
Q-01668,Pull the humidity readings from Tucán for the last hour—Mendoza mentioned the air feels off.,"get_telemetry(module='tucan',metric='humidity',timeframe_hours=1)"
Q-01669,Radiation sensors in Colibrí are reading 7.4 mSv/hr and rising—what emergency steps should we take for this scenario?,"activate_protocol(protocol_id='MASA-SEC-004',scope='station_wide')"
Q-01670,"Notify Fatima immediately—her latest Quetzal experiment telemetry shows anomalous readings, and we need her assessment before the next station-wide comms window.","send_message(recipient='specialist_2',priority='high')"
Q-01671,We’ve got a rapid pressure drop in Colibrí—sensors just hit 72.5 kPa and still falling. Commander Reyes is reporting possible hull breach signs. What emergency procedure do we initiate for this scenario?,"activate_protocol(protocol_id='MASA-SEC-001',scope='station_wide')"
Q-01673,Jaguar airlock equalization rate is showing 1.2 kPa per minute and still increasing—what emergency procedure should we initiate for this scenario?,"activate_protocol(protocol_id='MASA-SEC-017',scope='module_only')"
Q-01674,I need to log an alert — Quetzal pressure sensors are reading 88.1 kPa and dropping. What emergency procedure should we initiate for this situation?,"send_alert(module='quetzal',severity='high',reason='pressure_drop')"
Q-01675,Cóndor's power grid is at 99.2% capacity—Reyes just reported grid stress. What emergency steps should we initiate immediately?,"send_alert(module='condor',severity='critical',reason='power_fluctuation')"
Q-01676,What is Pavel Kozlov currently working on in the Jaguar module?,"get_crew_status(module='jaguar',info='current_activity')"
Q-01677,Kai just reported Jaguar's temperature is rising at 2.9 degrees per minute—what emergency response should we initiate?,"send_alert(module='jaguar',severity='critical',reason='abnormal_temperature')"
Q-01678,We need to schedule an urgent power cell swap in Quetzal—Nakamura reported fluctuations during the last experiment.,"schedule_maintenance(module='quetzal',task='power_cell_swap',priority='urgent')"
Q-01679,Jaguar power grid showing 97.2% consumption and climbing rapidly — Kai Nakamura reports fluctuating readings. What emergency steps should we initiate for this situation?,"send_alert(module='jaguar',severity='critical',reason='power_fluctuation')"
Q-01680,Cóndor oxygen concentration just dropped to 14.2% and is still falling—what emergency response should we initiate? Commander Reyes is monitoring the situation closely.,"activate_protocol(protocol_id='MASA-SEC-010',scope='module_only')"
Q-01681,We’ve got a live CO2 issue in Colibrí—readings just hit 2.7% and climbing. Commander Reyes reports headaches in the crew. What emergency steps should we take here?,"activate_protocol(protocol_id='MASA-SEC-009',scope='module_only')"
Q-01682,Tucán oxygen concentration has dropped to 13.3%—what emergency procedure do we follow?,"activate_protocol(protocol_id='MASA-SEC-002',scope='station_wide')"
Q-01683,Jaguar oxygen concentration has dropped to 14.4% and is still falling — what emergency procedure do we initiate right now?,"activate_protocol(protocol_id='MASA-SEC-010',scope='module_only')"
Q-01684,Jaguar temperature is rising at 2.4 degrees per minute—what emergency procedure covers this kind of thermal event?,"activate_protocol(protocol_id='MASA-SEC-003',scope='module_only')"
Q-01685,Tucán oxygen concentration has dropped to 15.9% — Engineer Kozlov noticed the decline while running diagnostics. Should we log an alert for this?,"send_alert(module='tucan',severity='high',reason='oxygen_leak')"
Q-01686,Vicuña power bus voltage just hit 103.8 V—what emergency procedure covers this kind of fluctuation?,"activate_protocol(protocol_id='MASA-SEC-018',scope='module_only')"
Q-01687,"We’ve got a rapid pressure drop in Quetzal, currently reading 82.0 kPa—what emergency procedure should we initiate for this scenario?","activate_protocol(protocol_id='MASA-SEC-001',scope='station_wide')"
Q-01688,Decrease the filtration rate in Quetzal—specialists report the system is running too aggressively.,"control_system(module='quetzal',system='filtration',action='decrease')"
Q-01689,Oxygen concentration in Quetzal just dropped to 10.8% and is still falling—what emergency steps should we take for this situation?,"activate_protocol(protocol_id='MASA-SEC-002',scope='station_wide')"
Q-01691,Vicuña hull stress sensors are reading 88.4% and climbing—should we flag this for possible micrometeorite impact?,"send_alert(module='vicuna',severity='high',reason='structural_damage')"
Q-01693,Ana Valdivia just reported oxygen concentration in Quetzal is reading 10.2% on her console—how should we handle this situation?,"send_alert(module='quetzal',severity='critical',reason='oxygen_leak')"
Q-01694,Generate the docking trajectory for Kuntur Station's upcoming planned maneuver at 408 km LEO.,"calculate_trajectory(maneuver='docking',urgency='planned')"
Q-01696,Nakamura just reported unusual hull stress readings in Quetzal—can we get an urgent inspection scheduled?,"schedule_maintenance(module='quetzal',task='hull_inspection',priority='urgent')"
Q-01697,We’ve got a pressure anomaly in Vicuña—readings just hit 88.2 kPa and still dropping. What emergency procedure should we initiate for this scenario?,"activate_protocol(protocol_id='MASA-SEC-011',scope='module_only')"
