id,query,tool_call
Q-00001,Cóndor radiation sensors are showing 2.1 mSv/hr and climbing—Commander Reyes has requested we initiate emergency procedures for this scenario.,"activate_protocol(protocol_id='MASA-SEC-012',scope='station_wide')"
Q-00002,"We’ve got a rapid temperature rise in Quetzal, currently reading 3.3 degrees per minute. What emergency procedure should we initiate for this scenario?","activate_protocol(protocol_id='MASA-SEC-003',scope='module_only')"
Q-00003,Can we get the trajectory calculations for the planned reentry maneuver at 408 km LEO before the next shift?,"calculate_trajectory(maneuver='reentry',urgency='planned')"
Q-00004,Give me the pressure readings from Cóndor for the past 24 hours to verify stability.,"get_telemetry(module='condor',metric='pressure',timeframe_hours=24)"
Q-00005,Schedule routine system calibration for Colibrí communications module during the next maintenance window.,"schedule_maintenance(module='colibri',task='system_calibration',priority='routine')"
Q-00007,We’ve got a live CO2 issue in Colibrí—readings just hit 2.1% and climbing. Commander Reyes reports headaches from the crew. What emergency steps should we take here?,"activate_protocol(protocol_id='MASA-SEC-009',scope='module_only')"
Q-00009,"Can you confirm the current crew schedule and activities in Jaguar, specifically for Engineer Kozlov, before the next shift change?","get_crew_status(module='jaguar',info='schedule')"
Q-00010,"Tucán radiation sensors are at 1.7 mSv/hr and rising—Commander Reyes wants this logged up the chain immediately. Solar activity is increasing, so we need to know what emergency response covers this.","send_alert(module='tucan',severity='medium',reason='radiation_spike')"
Q-00011,Ana Valdivia just reported the Vicuña airlock equalization rate is climbing to 0.7 kPa per minute—what emergency steps do we initiate for this situation?,"activate_protocol(protocol_id='MASA-SEC-017',scope='module_only')"
Q-00012,Radiation sensors in Vicuña are reading 1.4 mSv/hr and climbing; what emergency procedure do we initiate for this scenario?,"activate_protocol(protocol_id='MASA-SEC-012',scope='station_wide')"
Q-00013,Nakamura just reported power fluctuations in Quetzal during his last experiment—can we get the current status of the module's power system to assess stability?,"get_module_status(module='quetzal',system='power')"
Q-00016,Tucán pressure sensors are showing 87.8 kPa and still dropping—what emergency response should we initiate?,"activate_protocol(protocol_id='MASA-SEC-011',scope='module_only')"
Q-00017,Can you give me a quick overview of Kuntur Station's current mission and module layout before the next crew briefing?,no_action
Q-00018,Kozlov just reported a critical issue with the life support systems in Jaguar—this needs immediate attention from the engineer on duty.,"send_message(recipient='engineer',priority='urgent')"
Q-00019,Jaguar airlock equalization rate is showing 1.2 kPa per minute and still increasing—what emergency procedure should we initiate for this scenario?,"activate_protocol(protocol_id='MASA-SEC-017',scope='module_only')"
Q-00020,Can we get the trajectory calculations for the planned docking maneuver at 408 km LEO?,"calculate_trajectory(maneuver='docking',urgency='planned')"
Q-00023,Can we get a quick health status update for the engineer currently working in the Jaguar module?,"get_crew_status(module='jaguar',info='health')"
Q-00024,Hull stress readings in Quetzal have spiked to 93.3% — Specialist Nakamura reports possible micrometeorite impact. What’s the emergency procedure here?,"activate_protocol(protocol_id='MASA-SEC-008',scope='module_only')"
Q-00026,"We’ve got a rapid pressure drop in Quetzal, currently reading 82.6 kPa—what emergency procedure should we initiate for this?","send_alert(module='quetzal',severity='critical',reason='pressure_drop')"
Q-00027,Jaguar power grid showing 98.1% consumption and climbing rapidly — Kai Nakamura reports fluctuating readings. What emergency steps should we initiate for this situation?,"send_alert(module='jaguar',severity='critical',reason='power_fluctuation')"
Q-00028,We need to schedule an urgent hull inspection for Vicuña module.,"schedule_maintenance(module='vicuna',task='hull_inspection',priority='urgent')"
Q-00029,I need to log an alert — Quetzal pressure sensors are reading 86.3 kPa and dropping. What emergency steps should we initiate for this situation?,"send_alert(module='quetzal',severity='high',reason='pressure_drop')"
Q-00030,Kozlov reported Jaguar's thermal system is showing irregularities—can we get a full status check on that module's heat management?,"get_module_status(module='jaguar',system='thermal')"
Q-00031,Schedule routine filter replacement in Tucán crew quarters during the next maintenance window.,"schedule_maintenance(module='tucan',task='filter_replacement',priority='routine')"
Q-00032,Check the inventory for spare EVA equipment and submit a routine resupply request before the next logistics window.,"request_supply(category='equipment',urgency='routine')"
Q-00033,Ana Valdivia just reported oxygen concentration in Quetzal is down to 14.2% and still dropping—what emergency procedure should we initiate for this?,"activate_protocol(protocol_id='MASA-SEC-010',scope='module_only')"
Q-00034,Jaguar power grid showing 97.2% consumption and climbing rapidly — Kai Nakamura reports fluctuating readings in the life support systems. What emergency steps do we initiate here?,"activate_protocol(protocol_id='MASA-SEC-006',scope='station_wide')"
Q-00035,Check the current thermal status in Tucán—need to confirm readings are within nominal range.,"get_module_status(module='tucan',system='thermal')"
Q-00036,Oxygen concentration in Jaguar has dropped to 12.2%—Engineer Kozlov reports crew experiencing lightheadedness. What emergency steps should we initiate?,"send_alert(module='jaguar',severity='critical',reason='oxygen_leak')"
Q-00037,We need to calculate the optimal reentry trajectory immediately—station altitude is 408 km LEO.,"calculate_trajectory(maneuver='reentry',urgency='immediate')"
Q-00038,Vicuña hull stress sensors just hit 88.2% and climbing — Commander Reyes reports a possible micrometeorite impact. What emergency steps do we take?,"send_alert(module='vicuna',severity='high',reason='structural_damage')"
Q-00039,Check the current thermal status in Jaguar and confirm all readings are within nominal ranges.,"get_module_status(module='jaguar',system='thermal')"
Q-00040,"We’re seeing a voltage fluctuation on the Jaguar power bus, currently reading 97.1 V. Engineer Kozlov just flagged it—should we escalate this to command?","send_alert(module='jaguar',severity='medium',reason='power_fluctuation')"
Q-00041,Schedule routine maintenance for Vicuña module to swap out power cells.,"schedule_maintenance(module='vicuna',task='power_cell_swap',priority='routine')"
Q-00042,Cóndor's oxygen concentration has dropped to 15.1% over the past 30 minutes—should we escalate this to command for further action?,"send_alert(module='condor',severity='high',reason='oxygen_leak')"
Q-00043,Cóndor's power grid is showing 99.4% consumption—should we flag this as a critical system stress?,"send_alert(module='condor',severity='critical',reason='power_fluctuation')"
Q-00046,Jaguar hull stress sensors are reading 91.9%—Engineer Kozlov reports possible micrometeorite impact. Should we flag this for immediate review?,"send_alert(module='jaguar',severity='high',reason='structural_damage')"
Q-00048,We’ve got a voltage fluctuation on Quetzal’s power bus—sensors just hit 135.4 V and still fluctuating. Fatima flagged it from the science console. What emergency response do we need to initiate here?,"activate_protocol(protocol_id='MASA-SEC-018',scope='module_only')"
Q-00049,Cóndor pressure sensors just dropped to 70.4 kPa—Reyes is reporting a possible hull breach. How should we handle this?,"send_alert(module='condor',severity='critical',reason='pressure_drop')"
Q-00050,I need to log an alert — oxygen sensors in Colibrí are showing 14.6% and dropping. What emergency steps should we initiate for this situation?,"send_alert(module='colibri',severity='high',reason='oxygen_leak')"
Q-00051,Shut down the cooling system in Vicuña immediately—temperature readings are climbing and approaching critical levels.,"control_system(module='vicuna',system='cooling',action='deactivate')"
Q-00052,Radiation sensors in Colibrí are reading 5.7 mSv/hr—what emergency response should we initiate?,"send_alert(module='colibri',severity='critical',reason='radiation_spike')"
Q-00053,Oxygen concentration in Colibrí just dropped to 12.3%—what emergency response should we initiate for this scenario?,"activate_protocol(protocol_id='MASA-SEC-002',scope='station_wide')"
Q-00055,Oxygen concentration in Colibrí just dropped to 12.6% — Kai Nakamura reports dizziness. What emergency procedure covers this?,"activate_protocol(protocol_id='MASA-SEC-002',scope='station_wide')"
Q-00056,Can you give me a quick overview of MASA's mission history and the main objectives for the current Cóndor-7 mission?,no_action
Q-00058,Tucán pressure sensors just hit 73.7 kPa and are still falling — what emergency procedure do we initiate?,"activate_protocol(protocol_id='MASA-SEC-001',scope='station_wide')"
Q-00059,Kai just reported radiation sensors in Quetzal are reading 4.0 mSv/hr and rising—what emergency procedure should we initiate for this scenario?,"activate_protocol(protocol_id='MASA-SEC-012',scope='station_wide')"
Q-00060,Jaguar temperature sensors are showing a rapid rise at 3.4 degrees per minute and still climbing—what emergency procedure should we initiate for this scenario?,"activate_protocol(protocol_id='MASA-SEC-003',scope='module_only')"
Q-00061,Cóndor airlock equalization rate is at 0.8 kPa per minute and rising—what emergency steps do we take for this scenario?,"activate_protocol(protocol_id='MASA-SEC-017',scope='module_only')"
Q-00064,Kai just reported Quetzal’s temp is climbing at 5.0 degrees per minute—should we escalate this to command?,"send_alert(module='quetzal',severity='critical',reason='abnormal_temperature')"
Q-00065,Radiation sensors in Jaguar are showing 1.1 mSv/hr and rising—what emergency response should we initiate?,"send_alert(module='jaguar',severity='medium',reason='radiation_spike')"
Q-00066,Pull the humidity readings from Jaguar for the last hour—Kozlov wants to check the trends.,"get_telemetry(module='jaguar',metric='humidity',timeframe_hours=1)"
Q-00067,We've just received a distress call from Quetzal — Commander Reyes reports the crew is out of food rations and needs an emergency resupply immediately.,"request_supply(category='food',urgency='emergency')"
Q-00068,Lower the heating level in Colibrí—Pilot Valdivia reports the temperature is rising above nominal.,"control_system(module='colibri',system='heating',action='decrease')"
Q-00069,Tucán oxygen concentration has dropped to 15.6% — what emergency procedure do we need to activate here?,"activate_protocol(protocol_id='MASA-SEC-010',scope='module_only')"
Q-00070,Kai just reported radiation sensors in Jaguar are showing 7.2 mSv/hr and still rising—what emergency procedure should we initiate for this?,"activate_protocol(protocol_id='MASA-SEC-004',scope='station_wide')"
Q-00071,"Can you pull up the training records for the current crew, specifically focusing on emergency response drills completed in the last six months?",no_action
Q-00072,We’ve got a rapid pressure drop in Jaguar—sensors just hit 71.2 kPa and still falling. Commander Reyes reports possible hull breach. What emergency procedure do we initiate?,"activate_protocol(protocol_id='MASA-SEC-001',scope='station_wide')"
Q-00073,Check the current health status for the crew member in Colibrí before the next shift change.,"get_crew_status(module='colibri',info='health')"
Q-00074,"We need an immediate reentry trajectory calculation—current altitude is 408 km, and we're preparing for descent.","calculate_trajectory(maneuver='reentry',urgency='immediate')"
Q-00076,Hull stress readings in Colibrí have hit 85.5% — Kai Nakamura just reported possible micrometeorite impact. What emergency steps should we initiate?,"send_alert(module='colibri',severity='high',reason='structural_damage')"
Q-00078,Oxygen concentration in Quetzal just dropped to 13.3% — Kai Nakamura reports dizziness. How should we handle this?,"send_alert(module='quetzal',severity='critical',reason='oxygen_leak')"
Q-00079,We’ve got a rapid pressure drop in Jaguar—sensors just hit 82.8 kPa and still falling. Commander Reyes reports possible hull breach. What emergency procedure do we initiate here?,"activate_protocol(protocol_id='MASA-SEC-001',scope='station_wide')"
Q-00080,"Give me the current power status for Cóndor module, focusing on main and backup systems.","get_module_status(module='condor',system='power')"
Q-00081,Radiation sensors in Quetzal just spiked to 8.0 mSv/hr—what emergency steps do we take for this scenario?,"activate_protocol(protocol_id='MASA-SEC-004',scope='station_wide')"
Q-00082,Kai Nakamura just reported CO2 concentration in Vicuña has climbed to 2.3%—crew experiencing headaches. What emergency procedure should we initiate for this situation?,"activate_protocol(protocol_id='MASA-SEC-009',scope='module_only')"
Q-00083,"Ana Valdivia just reported headaches from Colibrí, CO2 concentration climbing to 2.5%—should we log an alert for this?","send_alert(module='colibri',severity='high',reason='oxygen_leak')"
Q-00084,Oxygen readings in Vicuña are at 15.7% and still dropping—what emergency response should we initiate?,"send_alert(module='vicuna',severity='high',reason='oxygen_leak')"
Q-00085,Check Jaguar's structural integrity status — Kozlov mentioned unusual stress readings during his last systems check.,"get_module_status(module='jaguar',system='structural')"
Q-00086,Cóndor module CO2 sensors are reading 2.6% and climbing—Commander Reyes reports crew headaches. What emergency procedure should we initiate for this scenario?,"activate_protocol(protocol_id='MASA-SEC-009',scope='module_only')"
Q-00087,Jaguar power grid showing 98.2% consumption and climbing rapidly—what emergency response should we initiate for this scenario?,"activate_protocol(protocol_id='MASA-SEC-006',scope='station_wide')"
Q-00088,Jaguar power grid showing 97.3% consumption and climbing rapidly — Kai Nakamura just reported possible overload risk. What emergency procedure should we initiate?,"send_alert(module='jaguar',severity='critical',reason='power_fluctuation')"
Q-00089,We’re seeing a voltage fluctuation on the Colibrí power bus—current reading is 131.4 V. What emergency procedure should we initiate for this?,"activate_protocol(protocol_id='MASA-SEC-018',scope='module_only')"
Q-00090,I need to log an alert — Vicuña temperature rate sensors are reading 4.2 degrees per minute and climbing.,"send_alert(module='vicuna',severity='critical',reason='abnormal_temperature')"
Q-00091,Oxygen concentration in Vicuña just dropped to 12.0% and still falling — should we flag this to Commander Reyes immediately?,"send_alert(module='vicuna',severity='critical',reason='oxygen_leak')"
Q-00092,Cóndor pressure sensors are showing 87.6 kPa and still dropping — how should we handle this?,"send_alert(module='condor',severity='high',reason='pressure_drop')"
Q-00093,Radiation sensors in Jaguar are showing 8.1 mSv/hr and still rising—what emergency measures should we initiate based on this reading? Engineer Kozlov flagged it during his system check.,"activate_protocol(protocol_id='MASA-SEC-004',scope='station_wide')"
Q-00095,Check the current schedule for the crew in Vicuña—need to coordinate cargo ops before the next shift.,"get_crew_status(module='vicuna',info='schedule')"
Q-00096,We’re getting reports from Lucía Mendoza that CO2 concentration in Colibrí has climbed to 2.6% and crew are experiencing headaches. What emergency procedure do we initiate here?,"activate_protocol(protocol_id='MASA-SEC-009',scope='module_only')"
Q-00097,Vicuña power bus voltage just hit 137.8 V—what emergency procedure covers this kind of fluctuation?,"activate_protocol(protocol_id='MASA-SEC-018',scope='module_only')"
Q-00098,Cóndor airlock equalization rate is reading 0.7 kPa per minute—what emergency response should we initiate?,"activate_protocol(protocol_id='MASA-SEC-017',scope='module_only')"
Q-00100,Tucán pressure sensors just hit 73.9 kPa and are still falling — what emergency procedure do we initiate?,"activate_protocol(protocol_id='MASA-SEC-001',scope='station_wide')"
Q-00101,We need an immediate trajectory recalculation—station's drifting out of nominal orbit at 408 km.,"calculate_trajectory(maneuver='orbit_adjustment',urgency='immediate')"
Q-00102,"Ana Valdivia just reported headaches from Colibrí, CO2 concentration climbing to 2.7%—should we log this as an alert?","send_alert(module='colibri',severity='high',reason='oxygen_leak')"
Q-00104,"We need an immediate trajectory calculation for an orbit adjustment—station altitude is 408 km LEO, and this can't wait.","calculate_trajectory(maneuver='orbit_adjustment',urgency='immediate')"
Q-00106,We’ve got a pressure anomaly in Colibrí—readings are at 88.8 kPa and still declining. What emergency steps should we take for this situation?,"activate_protocol(protocol_id='MASA-SEC-011',scope='module_only')"
Q-00107,Can we schedule a routine sensor repair in Vicuña during the next maintenance window?,"schedule_maintenance(module='vicuna',task='sensor_repair',priority='routine')"
Q-00108,Water recycling in Vicuña has dropped to 27.9% and been degrading for hours — what’s the emergency procedure for this scenario?,"activate_protocol(protocol_id='MASA-SEC-015',scope='station_wide')"
Q-00109,Ana Valdivia just reported radiation sensors in Colibrí are reading 1.7 mSv/hr and climbing. What emergency procedure should we initiate for this scenario?,"activate_protocol(protocol_id='MASA-SEC-012',scope='station_wide')"
Q-00110,Lower the cooling settings in Colibrí—Pilot Valdivia just reported the comms array is running hotter than nominal.,"control_system(module='colibri',system='cooling',action='decrease')"
Q-00111,"Radiation sensors in Quetzal are reading 2.7 mSv/hr, and Fatima Al-Hassan just reported solar activity is picking up. Should I flag this with command?","send_alert(module='quetzal',severity='high',reason='radiation_spike')"
Q-00112,Water recycling in Vicuña has dropped to 32.6% and been degrading for hours — which emergency steps should we take?,"activate_protocol(protocol_id='MASA-SEC-015',scope='station_wide')"
Q-00113,Water recycling in Vicuña has dropped to 35.8% and it's been degrading for hours—what emergency procedure should we initiate for this?,"activate_protocol(protocol_id='MASA-SEC-015',scope='station_wide')"
Q-00114,Cóndor's power bus is showing voltage fluctuations with a reading of 99.5 V—what emergency steps should we take for this scenario?,"activate_protocol(protocol_id='MASA-SEC-018',scope='module_only')"
Q-00115,"We’ve got a voltage fluctuation on Jaguar’s power bus, currently reading 102.1 V. What emergency procedure should we initiate for this?","send_alert(module='jaguar',severity='medium',reason='power_fluctuation')"
Q-00116,Pull the last 24 hours of oxygen telemetry from Cóndor for the shift log.,"get_telemetry(module='condor',metric='oxygen',timeframe_hours=24)"
Q-00118,Cóndor radiation sensors are showing 2.1 mSv/hr and climbing—Commander Reyes reports solar activity may be increasing. What emergency procedure should we initiate?,"activate_protocol(protocol_id='MASA-SEC-012',scope='station_wide')"
Q-00119,We’ve got a rapid temperature rise in Quetzal—3.9 degrees per minute and climbing. Kai just reported it. What emergency steps do we take for this scenario?,"activate_protocol(protocol_id='MASA-SEC-003',scope='module_only')"
Q-00120,Radiation sensors in Tucán are spiking at 10.1 mSv/hr—Commander Reyes reports it’s still climbing. What emergency procedure do we initiate for this?,"activate_protocol(protocol_id='MASA-SEC-004',scope='station_wide')"
Q-00121,Activate the ventilation system in Quetzal—Nakamura just reported elevated CO₂ levels during the last experiment.,"control_system(module='quetzal',system='ventilation',action='activate')"
Q-00122,We’ve got a rapid temperature rise in Vicuña—sensors are showing 4.4 degrees per minute and climbing. What emergency procedure should we initiate for this scenario?,"activate_protocol(protocol_id='MASA-SEC-003',scope='module_only')"
Q-00123,"We’re seeing a voltage fluctuation on the Colibrí power bus, with readings dropping to 97.4 V. This is outside the normal range—should we flag this for further action?","send_alert(module='colibri',severity='medium',reason='power_fluctuation')"
Q-00124,Can you pull up the overview of MASA's operational structure and current mission objectives for the Cóndor-7 crew?,no_action
Q-00125,Tucán power bus showing voltage fluctuations—current reading at 103.7 V. Should we escalate this to command?,"send_alert(module='tucan',severity='medium',reason='power_fluctuation')"
Q-00126,We’re seeing a voltage fluctuation on Quetzal’s power bus—current reading is 96.1 V. Should we flag this for further review?,"send_alert(module='quetzal',severity='medium',reason='power_fluctuation')"
Q-00127,Radiation sensors in Colibrí are reading 9.5 mSv/hr—what emergency response should we initiate? Commander Reyes is monitoring the situation closely.,"activate_protocol(protocol_id='MASA-SEC-004',scope='station_wide')"
Q-00128,Pull the last six hours of oxygen level telemetry from Vicuña for trend analysis.,"get_telemetry(module='vicuna',metric='oxygen',timeframe_hours=6)"
Q-00129,Can we get the trajectory calculations for the planned station-keeping maneuver at 408 km LEO?,"calculate_trajectory(maneuver='station_keeping',urgency='planned')"
Q-00130,We need an immediate trajectory calculation for station-keeping—current altitude is 408 km and we're seeing drift.,"calculate_trajectory(maneuver='station_keeping',urgency='immediate')"
Q-00131,Jaguar’s CO₂ sensors are reading 2.3% and climbing—crew reports headaches. What’s the emergency procedure for this scenario?,"activate_protocol(protocol_id='MASA-SEC-009',scope='module_only')"
Q-00133,"Ana, urgent message from Kuntur—radiation shielding anomaly detected in Colibrí during the last pass. Commander wants your eyes on this immediately.","send_message(recipient='pilot',priority='high')"
Q-00134,Radiation sensors in Vicuña are reading 8.5 mSv/hr and climbing — what emergency procedure do we initiate for this scenario?,"activate_protocol(protocol_id='MASA-SEC-004',scope='station_wide')"
Q-00135,Can we expedite a fuel resupply to Kuntur Station? The current reserves are lower than expected for the upcoming maneuver schedule.,"request_supply(category='fuel',urgency='expedited')"
Q-00136,Can you pull the scientific research program objectives for the current mission so I can brief the new shift lead on the key experiments?,no_action
Q-00137,Oxygen concentration in Jaguar has dropped to 13.1%—what emergency procedure should we initiate? Engineer Kozlov just reported the crew is feeling lightheaded.,"activate_protocol(protocol_id='MASA-SEC-002',scope='station_wide')"
Q-00138,Radiation sensors in Jaguar are showing 11.3 mSv/hr and climbing—what emergency procedure do we initiate for this?,"activate_protocol(protocol_id='MASA-SEC-004',scope='station_wide')"
Q-00139,Get the urgent software update for Cóndor on the schedule before the next crew shift change.,"schedule_maintenance(module='condor',task='software_update',priority='urgent')"
Q-00141,Cut all non-essential lighting in Colibrí—we need to conserve power while rerouting the auxiliary array.,"control_system(module='colibri',system='lighting',action='deactivate')"
Q-00142,Radiation sensors in Colibrí just spiked to 5.3 mSv/hr—Commander Reyes reports it’s still climbing. What emergency procedure do we initiate for this?,"activate_protocol(protocol_id='MASA-SEC-004',scope='station_wide')"
Q-00143,Ana Valdivia just reported feeling lightheaded in Colibrí—can we get her current health status?,"get_crew_status(module='colibri',info='health')"
Q-00144,Vicuña power bus voltage just hit 97.6 V and continues to drop—what emergency response should we initiate?,"activate_protocol(protocol_id='MASA-SEC-018',scope='module_only')"
Q-00145,Check the current thermal status in Cóndor—Commander Reyes noted the readings were off during his last report.,"get_module_status(module='condor',system='thermal')"
Q-00146,We’ve got a rising CO2 issue in Quetzal—readings just hit 2.8% and climbing. Commander Reyes reports the crew is experiencing headaches. What emergency steps do we need to initiate for this scenario?,"activate_protocol(protocol_id='MASA-SEC-009',scope='module_only')"
Q-00147,Notify Fatima immediately—her attention is required on an urgent matter.,"send_message(recipient='specialist_2',priority='high')"
Q-00148,Radiation sensors in Tucán are reading 5.4 mSv/hr and climbing—should we flag this to the Commander immediately?,"send_alert(module='tucan',severity='critical',reason='radiation_spike')"
Q-00150,Can we pull Mendoza's current schedule and activities in Tucán for the next shift? Kozlov mentioned she had a medical check planned.,"get_crew_status(module='tucan',info='schedule')"
Q-00151,Tucán airlock equalization rate is showing 1.4 kPa per minute and still increasing—what emergency procedure should we initiate for this?,"activate_protocol(protocol_id='MASA-SEC-017',scope='module_only')"
